30020,"Lawton, OK (Metropolitan Statistical Area)",2.2,6.9,-1.9,-0.3,3.9,-2.6,6.1,2.7,0,-2.6,-5.2,2.5,0.1,2.7,0.7,-0.1
30140,"Lebanon, PA (Metropolitan Statistical Area)",1.5,6.9,0.1,-2,-1.3,-1.4,-1.3,-2.3,3.5,0.3,-0.8,2.2,-1.3,1.6,1.3,1.1
30300,"Lewiston, ID-WA (Metropolitan Statistical Area)",2.1,0.7,-0.3,-0.3,0.3,0.6,1.6,-2.2,1.4,-0.2,-0.9,-1.6,-2,3.1,1.6,2.1
30340,"Lewiston-Auburn, ME (Metropolitan Statistical Area)",5.1,1.1,1.6,-0.5,2.9,1.1,-1.7,-3.5,-1.4,-2.3,0.2,-1.1,1.8,0.1,1.6,1
30460,"Lexington-Fayette, KY (Metropolitan Statistical Area)",3.6,-2.3,1.4,1.8,1.5,0.3,-3.7,-7.7,3.8,-0.2,2.1,0,0,2.1,2.3,-0.1
30620,"Lima, OH (Metropolitan Statistical Area)",3.8,2.1,3.2,2.8,1.2,-2.2,-6.4,12,0.2,-0.3,-5.1,1.6,7.6,-8.4,0.5,2.8
30700,"Lincoln, NE (Metropolitan Statistical Area)",1,4.7,-2.5,0.6,0.2,1.4,-2.2,-1.3,2.9,1.2,3.2,0.9,1,1.2,-0.1,0.3
30780,"Little Rock-North Little Rock-Conway, AR (Metropolitan Statistical Area)",-0.9,2.9,1.8,2.3,2.5,6.2,-2.2,-1.1,-1.1,-1.1,0.2,-3.5,0.5,1.5,-0.2,0.3
30860,"Logan, UT-ID (Metropolitan Statistical Area)",1.4,7.7,2.4,-0.6,2.9,2.8,1.5,-1.3,6,3.3,-2.3,-3,2.8,4.3,0.1,-0.9
30980,"Longview, TX (Metropolitan Statistical Area)",0,0.5,4,8.4,10.4,5.9,4,-7,3.9,-6.1,2.5,0.4,1.5,-5.9,-7.8,2.3
31020,"Longview, WA (Metropolitan Statistical Area)",-4.6,6.4,0.9,4.1,-1.9,2,-1.7,-2.5,7.6,-2.5,0.9,3.3,-0.2,-1.1,2.1,1.2
31080,"Los Angeles-Long Beach-Anaheim, CA (Metropolitan Statistical Area)",2.4,3.9,3.9,3,4.6,1.7,0.3,-5.5,1.2,0,2,1.2,3.2,4.5,1,2.6
31140,"Louisville/Jefferson County, KY-IN (Metropolitan Statistical Area)",-0.7,1,1.9,1.1,1.4,-0.2,-3.6,-5.6,3.7,2.2,3.1,-0.9,5.6,1.4,0.7,0.8
31180,"Lubbock, TX (Metropolitan Statistical Area)",3.2,1.3,3.8,3.7,1.2,-1.6,0,0,2.1,-2.6,1.6,4.9,-2.2,1.9,1,0.7
31340,"Lynchburg, VA (Metropolitan Statistical Area)",-2.8,3.1,0.7,1.8,1.7,-1.1,-1,-0.9,1.9,-2.3,-1.4,-0.4,-0.6,-1,0.4,2
31420,"Macon-Bibb County, GA (Metropolitan Statistical Area)",-2.1,-0.8,2,-0.8,-3.6,-3.9,2,-4.3,0.7,-2,0.4,3.1,4.6,0.1,0.7,0.8
31460,"Madera, CA (Metropolitan Statistical Area)",8.4,2.6,8,6.1,-1.4,-2.3,-3.4,-8.5,8.3,-0.3,4.9,4.2,6.3,2.8,8.9,-5.5
31540,"Madison, WI (Metropolitan Statistical Area)",2.4,1.4,3.1,2.3,0.2,1.1,-2.1,-1.3,0.8,1.1,0,1.2,-0.6,6.8,2.8,0.7
31700,"Manchester-Nashua, NH (Metropolitan Statistical Area)",5.5,7.8,1,5.8,0.9,0.4,0.8,-2.9,-0.4,4.8,-0.9,1.6,1,4.8,3.6,1
31740,"Manhattan, KS (Metropolitan Statistical Area)",1.8,3.4,8.6,-3.3,-5.5,3.9,2.5,-2.6,1.6,6.5,-9.5,-2.2,1,2.8,6.2,1.9
31860,"Mankato-North Mankato, MN (Metropolitan Statistical Area)",4.3,1.1,0.6,3.9,6.6,-8.4,0.2,-6.7,3.5,3.2,3.6,3.5,4.1,-0.5,-0.3,1.6
31900,"Mansfield, OH (Metropolitan Statistical Area)",3.9,2.6,4.8,0.7,0.8,-5.2,-2.4,-13.1,4.5,2.3,0.8,1.9,2,-1.2,0.1,1.9
32580,"McAllen-Edinburg-Mission, TX (Metropolitan Statistical Area)",1.5,3.8,4.8,1,0.9,-2.8,-1.8,0.1,1.2,1,0.5,1.3,1.6,0.4,0.3,0.7
32780,"Medford, OR (Metropolitan Statistical Area)",1.5,1.5,3.8,-1.2,-2.9,-2.7,-2.5,-3,-3.1,0.7,2.5,1.8,1.9,2.7,4,1.3
32820,"Memphis, TN-MS-AR (Metropolitan Statistical Area)",2.3,0.7,1.5,-0.8,-1.1,-0.6,-2.5,-4.9,1.1,-1.3,-0.5,-1,-0.7,0.8,0.8,0.1
32900,"Merced, CA (Metropolitan Statistical Area)",10.6,5.6,4.4,1.3,-1.9,2.3,-7.5,1,-2.7,3,-7.5,7.5,5.7,-1,6.4,-1.8
33100,"Miami-Fort Lauderdale-West Palm Beach, FL (Metropolitan Statistical Area)",1.4,1.5,3.5,7,2.5,-0.3,-5.4,-9.3,-0.2,-1.8,1,-2.6,5.2,3.7,1.6,1.5
33140,"Michigan City-La Porte, IN (Metropolitan Statistical Area)",3.5,-0.7,3.1,-1.3,-0.1,0.6,-0.9,-6.8,2.7,-0.4,0.2,1,-3,-4.3,4.1,0.5
33220,"Midland, MI (Metropolitan Statistical Area)",5.9,-3.7,7.7,-8.5,-0.2,2.8,-2.1,-3.7,2.6,2.1,-2.7,-0.8,14.5,9,5.8,9.6
33260,"Midland, TX (Metropolitan Statistical Area)",6.8,-16.8,-15.6,-7.2,-4,4.7,21.4,-6.2,5.9,19.6,14,5,9.2,-2.1,-6.3,6.6
33340,"Milwaukee-Waukesha-West Allis, WI (Metropolitan Statistical Area)",0,2.9,1.8,3.5,3.3,-0.3,-0.7,-4.2,1.8,2.4,0.6,1,0.9,-3.3,1.7,1.1
33460,"Minneapolis-St. Paul-Bloomington, MN-WI (Metropolitan Statistical Area)",0.4,3.4,2.7,2.2,-2,0.1,-1.5,-4.7,1.5,1.9,-0.3,0.6,2.3,0.9,1,1
33540,"Missoula, MT (Metropolitan Statistical Area)",2.1,3.3,-0.9,0.7,-0.1,1.8,1,-2.2,0.3,-2.4,2.3,-2,-1.2,3.8,2.4,1.5
33660,"Mobile, AL (Metropolitan Statistical Area)",0.6,1.1,3.2,4.2,5.8,-2,-1,-1.8,-0.1,1.9,-2.4,-1.4,-0.3,2,1.7,0
33700,"Modesto, CA (Metropolitan Statistical Area)",2.6,2.4,5,0.6,-1.6,-4,-0.6,-1.4,-1.7,-0.7,-3,1.4,4.7,3.2,3.2,-1.5
33740,"Monroe, LA (Metropolitan Statistical Area)",5.2,-0.7,3.2,0.6,1.8,-0.9,-3.9,5.2,0.1,-3.3,-1.9,1.2,-0.4,7.3,3.2,1.7
33780,"Monroe, MI (Metropolitan Statistical Area)",12.1,-0.5,-0.7,-5.1,0.6,-4.8,-6.3,-8,6.5,4.5,4.4,1.9,-1.4,-0.6,6.5,-0.4
33860,"Montgomery, AL (Metropolitan Statistical Area)",2,1,6.4,-1.7,-1,-2.7,2.1,-3.7,0,-0.2,-0.6,0.7,-0.9,1,1.9,-0.8
34060,"Morgantown, WV (Metropolitan Statistical Area)",-4.5,1,5.7,3.8,1,-2,2.9,6.3,1.4,-0.9,-0.3,2.4,1.2,3,1.1,2.9
34100,"Morristown, TN (Metropolitan Statistical Area)",0.4,2.9,4.7,-4.4,1.6,-5.5,-3.9,-9.9,7.6,0.4,4.9,-0.1,1.5,2.2,0.8,1.7
34580,"Mount Vernon-Anacortes, WA (Metropolitan Statistical Area)",9.9,-4.3,-3.9,30,-19.3,-3.2,-0.8,6.1,1.5,-15.1,-6,5.9,-1.6,8.3,4.2,0.8
34620,"Muncie, IN (Metropolitan Statistical Area)",1.1,1.6,-1.4,-2.2,2.1,-4.3,-1.9,-6.4,1.7,2.3,4.8,-1,-1.3,-0.3,1.6,0.8
34740,"Muskegon, MI (Metropolitan Statistical Area)",0.3,-0.3,-0.1,0.1,-0.3,-3.4,-2.2,-3.2,3.4,2.9,1.9,1.4,1.5,1.7,0.9,0.1
34820,"Myrtle Beach-Conway-North Myrtle Beach, SC-NC (Metropolitan Statistical Area)",2.3,-0.7,3.6,6.1,-5.2,-5.4,-9.5,-5.7,-2.1,0.2,0.1,-0.2,-1.2,-1.2,-2.4,-1.8
34900,"Napa, CA (Metropolitan Statistical Area)",-1.2,-0.7,0.5,5.1,2.8,-1.7,-0.6,-3.5,-5.9,-1,6,3.2,4.8,6.2,2.9,3.4
34940,"Naples-Immokalee-Marco Island, FL (Metropolitan Statistical Area)",-2.5,-6.5,-3.3,4.6,1.5,-4.5,-12.1,-10.3,0.2,-2.1,0.3,-1.3,4.5,4.6,0.5,-0.6
34980,"Nashville-Davidson--Murfreesboro--Franklin, TN (Metropolitan Statistical Area)",1.9,2.3,3.4,0,1.4,-3.5,0.2,-5.5,1,3.6,5.5,1.5,2.5,4.2,2.6,2.2
35100,"New Bern, NC (Metropolitan Statistical Area)",0,3.5,3.7,5.3,-1,-2.7,-3.3,-1.7,1.2,-2.6,0,0.4,-0.5,1.1,0.2,-0.8
35300,"New Haven-Milford, CT (Metropolitan Statistical Area)",2.1,0.7,5.5,-0.4,4.1,-1.4,-5.8,-5.4,0.1,-1.2,-0.7,-0.1,-1.2,1.1,1.6,1.7
35380,"New Orleans-Metairie, LA (Metropolitan Statistical Area)",0,2.7,1.6,-1,23.9,-10,-3.6,-2.3,2.5,-9.8,-0.4,-6.8,2.6,4.8,-0.8,-1.2
35620,"New York-Newark-Jersey City, NY-NJ-PA (Metropolitan Statistical Area)",-0.5,0.2,2.8,4.1,3,1.2,-3.5,-0.2,2.9,-0.5,2.2,-0.4,1.3,1.5,0.1,1.1
35660,"Niles-Benton Harbor, MI (Metropolitan Statistical Area)",5.1,-1.1,0.1,-0.3,3,2.9,-6.1,-2.3,6.9,-4.9,-2,4.1,1.8,0.8,0.9,-0.5
35840,"North Port-Sarasota-Bradenton, FL (Metropolitan Statistical Area)",6,5.8,6.1,7.2,0,-5.1,-9.5,-8,-2.5,-1.1,-1,-0.2,3,3.6,0.4,0.2
35980,"Norwich-New London, CT (Metropolitan Statistical Area)",6.8,5.2,13.6,-3,1,0.6,-9,-4.7,0.6,-1.9,-2,-2.1,-3.4,3.6,-0.4,2.6
36100,"Ocala, FL (Metropolitan Statistical Area)",2.1,3.8,1.5,2.5,4.5,-3.6,-5.5,-10.9,-2.1,-1.4,-0.6,-3.6,2.6,1.2,3.9,-1.1
36140,"Ocean City, NJ (Metropolitan Statistical Area)",6.9,8.9,13.5,3.6,-8.6,-9.9,-2.2,-0.2,0.2,1.6,-1.1,6.8,2.7,-2,1.8,0.2
36220,"Odessa, TX (Metropolitan Statistical Area)",-1.7,-4.6,-0.6,5.8,13,14.8,4.6,-8.7,4.2,16.4,18,6.1,2.2,-14.2,-12.9,12.4
36260,"Ogden-Clearfield, UT (Metropolitan Statistical Area)",2.5,1.2,0.4,0.4,5.1,-0.7,-3.8,-0.9,0.2,-0.8,-3.8,1,0.1,2.8,1.3,1
36420,"Oklahoma City, OK (Metropolitan Statistical Area)",1.2,4.3,-1.5,0.6,1.1,-0.4,0.1,0.6,-0.8,0.9,1.6,2.7,-0.3,6.9,-3.4,1.4
36500,"Olympia-Tumwater, WA (Metropolitan Statistical Area)",0.9,0.5,2.9,1.2,-1.4,1.9,-0.9,-2.1,-1.1,-3.3,-1.4,0,-0.6,2.2,2.4,2.6
36540,"Omaha-Council Bluffs, NE-IA (Metropolitan Statistical Area)",1.1,1.6,5.1,1.3,2,-0.9,-1.5,-1.9,1.2,1.8,1.3,-0.9,4,3.1,0.9,-0.1
36740,"Orlando-Kissimmee-Sanford, FL (Metropolitan Statistical Area)",-0.5,4,2,1.6,0.7,2,-2.1,-7.4,-1.5,-1.8,-1.8,7.1,-4.3,1.2,-0.7,-0.4
36780,"Oshkosh-Neenah, WI (Metropolitan Statistical Area)",6.5,0,2.6,0.2,1,0.5,-2.5,-5.9,6.7,4.2,0.5,-2,1.5,2.2,2,1.1
36980,"Owensboro, KY (Metropolitan Statistical Area)",10.5,0.7,7.6,-12.1,6.9,-1.1,8.6,-1.4,-1.2,-0.2,-5.7,5.1,-0.3,1.1,-1.6,0.1
37100,"Oxnard-Thousand Oaks-Ventura, CA (Metropolitan Statistical Area)",0.9,6.6,4.5,1.6,2.8,2.3,-5.2,-0.4,4.3,1.4,1.3,1.5,-0.1,0.5,-1.1,-0.7
37340,"Palm Bay-Melbourne-Titusville, FL (Metropolitan Statistical Area)",3.2,4.2,7.2,4.8,0.9,2.8,-0.7,-4.9,0.2,-4.8,-2.9,0,-0.5,2,0.8,2.7
37460,"Panama City, FL (Metropolitan Statistical Area)",7.2,2.9,6.1,4,4.6,-2.2,-1.9,-3.7,-0.8,-5.1,-2.1,5.5,-0.5,-0.3,-0.4,-1.7
37620,"Parkersburg-Vienna, WV (Metropolitan Statistical Area)",1.1,-0.7,0.3,-2.7,7.5,-3.7,0.4,4,-3.3,3.5,3.8,0.5,14,-4,-3.9,3
37860,"Pensacola-Ferry Pass-Brent, FL (Metropolitan Statistical Area)",-2.1,1.4,4,1.1,4.6,-1.6,-4.1,-3.7,0.9,0,-0.4,1.5,-1.9,1.9,-0.3,0.5
37900,"Peoria, IL (Metropolitan Statistical Area)",-0.4,4.1,5.9,4.4,6.8,2.4,1.9,-5.2,2.3,9.2,6.6,-14.2,0.5,-4.4,-1.4,-4.4
37980,"Philadelphia-Camden-Wilmington, PA-NJ-DE-MD (Metropolitan Statistical Area)",1.1,2.6,2.6,1,1.7,2.3,0,-2.3,0.7,0,1.3,3.1,0.5,2.2,1.4,1.1
38060,"Phoenix-Mesa-Scottsdale, AZ (Metropolitan Statistical Area)",0.6,3.2,1.8,5,2.8,0,-5.8,-10.3,-0.6,1.1,1,-1.3,0.9,1.2,0.3,1.5
38220,"Pine Bluff, AR (Metropolitan Statistical Area)",1.6,3.3,4.2,0.5,3.2,-3.2,0.1,-2,1.2,-0.7,1.3,-1.5,-3.6,-4.8,5,-0.1
38300,"Pittsburgh, PA (Metropolitan Statistical Area)",0.3,2.9,-0.3,-0.8,1.4,-0.1,-0.2,0.7,3.4,2.8,0.6,1.8,3.7,3.5,0.6,4.1
38340,"Pittsfield, MA (Metropolitan Statistical Area)",12.6,0.7,8.5,3.7,-4.6,-15.1,-3.4,-1.6,0.4,8.4,2.5,-0.6,0.7,2.9,2.9,0
38540,"Pocatello, ID (Metropolitan Statistical Area)",-0.5,7.2,5.8,1,-2.1,2.4,1.2,-8.9,-0.4,0.6,0.2,-5.6,-0.5,1.1,2.1,1.3
38860,"Portland-South Portland, ME (Metropolitan Statistical Area)",0.5,2,4.5,-0.5,2.1,-0.6,-0.5,-1.6,2.5,-0.7,0,-0.6,1.4,1.8,2.2,1
38900,"Portland-Vancouver-Hillsboro, OR-WA (Metropolitan Statistical Area)",0.2,3.8,10.5,1.9,8.9,3,6.2,-1.1,6.7,3.9,-5.2,-3.6,0.3,2.1,1.8,1.8
38940,"Port St. Lucie, FL (Metropolitan Statistical Area)",5.6,1.7,6.9,5.4,-0.3,-2.8,-7.5,-6.4,-3.4,-2.8,0.3,-2.1,-0.7,2.3,-0.5,1.2
39140,"Prescott, AZ (Metropolitan Statistical Area)",1.9,3.3,1.2,3.1,1.2,-3.5,-5,-6.3,-4.5,0.8,0.8,-2.2,2,0.5,1.1,2.4
39300,"Providence-Warwick, RI-MA (Metropolitan Statistical Area)",2.3,3.6,2.3,1.1,2.7,-1.9,-1.2,-2.8,2.1,-0.2,1.4,-0.2,0.8,2.4,0.3,1.3
39340,"Provo-Orem, UT (Metropolitan Statistical Area)",-0.2,2.2,5.5,4.6,4.2,1.9,-6.4,-3.9,-3.7,1.7,1.8,2.3,2.7,9.4,4.2,2.9
39380,"Pueblo, CO (Metropolitan Statistical Area)",-1.3,1.8,6,-6.5,-1.4,-0.3,0.6,-1.7,-0.6,-0.2,2.2,-2.5,2,0.6,1.6,1.8
39460,"Punta Gorda, FL (Metropolitan Statistical Area)",3,0.4,1.1,9.4,0.4,-9,-5.4,-7.4,0.4,-0.6,2.7,-7,4.7,4.7,0.4,0.1
39540,"Racine, WI (Metropolitan Statistical Area)",0.5,2,3.5,-1.3,-3,-2.7,-4.6,-2.1,8.4,-2.3,0.6,-3.6,-0.9,-0.2,-1.7,-0.3
39580,"Raleigh, NC (Metropolitan Statistical Area)",-6.9,-0.4,3.1,1.4,1,2.5,-3.8,-4.1,-0.1,0,0.3,-1,2.5,4.7,1.2,0.4
39660,"Rapid City, SD (Metropolitan Statistical Area)",9.4,1.8,-2.4,-0.4,-2.7,-1.9,-2.1,-3.8,2.3,4.6,-0.3,-2.8,1.2,-1.1,1,0.5
39740,"Reading, PA (Metropolitan Statistical Area)",0.6,0.3,-2.3,0.5,3.1,-3.1,-2.3,-3,2.1,0.7,0.9,1.4,6.3,3.1,2.7,-7
39820,"Redding, CA (Metropolitan Statistical Area)",8.2,2.1,-4.3,-3.8,-0.7,-1.3,-5.4,-5.6,0.4,-0.4,-3.2,1,3.2,4.4,9.1,4
39900,"Reno, NV (Metropolitan Statistical Area)",-2.3,-0.2,4.1,-0.2,-0.3,-3.6,-9.2,-7.1,-0.6,-2,-3,3.9,3.3,0.8,2.2,3.8
40060,"Richmond, VA (Metropolitan Statistical Area)",-2.5,0,-2.6,5,-1.1,-1.2,-1.8,-3.1,0.9,0.1,1.6,0.3,0,2.7,0.1,1.6
40140,"Riverside-San Bernardino-Ontario, CA (Metropolitan Statistical Area)",3.5,4.1,5.8,3.6,-0.3,-4.2,-3.7,-9,-1.2,1.3,-2.1,3.2,1.5,4,1.6,1.7
40220,"Roanoke, VA (Metropolitan Statistical Area)",1.1,1,-0.4,2.8,0.2,0.5,-0.5,-1.5,-1.7,-1.2,-0.1,-0.6,-0.6,2.3,-1.6,-0.3
40340,"Rochester, MN (Metropolitan Statistical Area)",5.3,5.8,-1,-1.4,0.3,-3.1,0.6,-2.4,5.4,-1.5,2.8,-0.7,0.6,2.2,3,2.5
40380,"Rochester, NY (Metropolitan Statistical Area)",2.8,1.5,1,1.2,1.4,-3.1,-1.9,1,2.1,-1.8,0.3,0.4,-2.8,1.7,0.1,-0.3
40420,"Rockford, IL (Metropolitan Statistical Area)",-0.8,0.4,-0.5,0.4,1.9,-0.6,-3.1,-8.3,2.4,3.6,3.2,-1.7,2,-0.5,-0.8,3.6
40580,"Rocky Mount, NC (Metropolitan Statistical Area)",2.4,-0.3,-0.3,-3.1,2.9,-4.2,-1,0.3,0.3,1.4,-6.9,-0.2,-2.4,2.6,-7,-1.2
40660,"Rome, GA (Metropolitan Statistical Area)",-1.2,1.6,7.4,-6.1,-1.3,-0.2,-0.5,-3.3,-1.7,-1.8,2.4,1.6,0.5,0.8,2.3,-0.9
40900,"Sacramento--Roseville--Arden-Arcade, CA (Metropolitan Statistical Area)",2.2,4.4,1.6,2.5,-0.4,-2.5,-3.8,-6.4,-3,0.9,-0.2,1.2,1.1,2.6,1.3,1
40980,"Saginaw, MI (Metropolitan Statistical Area)",1.7,3,-2.6,1.2,1.4,-3.7,-6.6,-3.3,7.7,2.6,0.5,1.6,-0.1,-0.7,0.6,0.5
41060,"St. Cloud, MN (Metropolitan Statistical Area)",2.9,-0.1,4,-0.2,-0.9,-4,0.2,-4,1.9,0.7,2.1,0.8,3.8,-0.6,3.3,1.6
41100,"St. George, UT (Metropolitan Statistical Area)",-0.2,3.1,8.5,2.6,0.6,-0.9,-10.5,-10.1,-1,2.7,-1.3,2.5,1.9,4.4,4.9,0.9
41140,"St. Joseph, MO-KS (Metropolitan Statistical Area)",2.3,2.7,5.9,-1.2,5.8,1.5,-0.1,-0.6,0.9,-1.1,6,3.5,-4.6,-4.2,0.2,1.9
41180,"St. Louis, MO-IL (Metropolitan Statistical Area)",0.2,2.1,0.9,0.8,-1.2,0.1,1.4,-2.8,0.7,-0.7,0.9,1,0.8,0.8,0.2,0.5
41420,"Salem, OR (Metropolitan Statistical Area)",-0.3,-0.3,0.5,1.1,4.4,-3.7,2.4,-2.9,-2.6,-2.4,-0.8,0.6,3.9,5.1,4.8,0
41500,"Salinas, CA (Metropolitan Statistical Area)",3.6,4.8,-6.4,3.6,4.4,-5.7,-0.4,2.1,-1.9,-5.1,0.5,4.2,0.6,7.4,2.8,0.8
41540,"Salisbury, MD-DE (Metropolitan Statistical Area)",-1.2,4.2,7.3,4.2,2.9,-1.3,-6.2,-3.8,-1.2,-5.2,-1.3,5.3,4.3,6.8,2.8,1.1
41620,"Salt Lake City, UT (Metropolitan Statistical Area)",-1,0.4,2.6,4.3,5.6,4.8,-3.5,-4,0.8,2.4,0.7,-1.1,1.7,3.4,0.4,1
41660,"San Angelo, TX (Metropolitan Statistical Area)",0.7,-0.2,-0.6,4.3,-0.2,1.7,4.4,-4,-1,-4.1,0.7,4.8,9.3,-1.8,-2.9,-0.2
41700,"San Antonio-New Braunfels, TX (Metropolitan Statistical Area)",-0.6,2,1.3,0.1,3.3,-1.3,-0.5,-5.7,-0.3,1.7,3,4.4,5,6.2,1.6,2.6
41740,"San Diego-Carlsbad, CA (Metropolitan Statistical Area)",2.8,5.2,8.5,4.9,-0.2,-0.9,-2,-6.4,-0.8,2.1,-0.2,1.9,0,0,2.7,1.6
41860,"San Francisco-Oakland-Hayward, CA (Metropolitan Statistical Area)",0,0.9,2.5,5.3,3.3,2.8,1.3,-6.2,-3.8,-1.5,3.6,2.2,3.6,4.3,4.8,2.8
41940,"San Jose-Sunnyvale-Santa Clara, CA (Metropolitan Statistical Area)",-5,3.2,1.7,5.1,6.7,7.8,-0.9,-6.7,6.4,5.2,2,3.9,6,9.7,5.3,7.2
42020,"San Luis Obispo-Paso Robles-Arroyo Grande, CA (Metropolitan Statistical Area)",9.2,5.6,7.9,-3.9,-5.1,1.1,-2.7,-4.2,-0.1,-1,2.3,6,-0.8,3.3,1.5,1.3
42100,"Santa Cruz-Watsonville, CA (Metropolitan Statistical Area)",0.4,-0.7,-3,-0.2,1.1,-3.2,-1.2,0.5,3.4,-4.7,-2.4,4.7,1.8,2.2,0.1,0.3
42140,"Santa Fe, NM (Metropolitan Statistical Area)",12.7,-9.8,-1.7,0.7,5.9,-1.6,7.4,-12,1.4,-3,-3.2,2.6,-5.9,1.6,-2,1.1
42200,"Santa Maria-Santa Barbara, CA (Metropolitan Statistical Area)",3,2.8,4.5,3.1,0.2,-0.8,-1.2,0.7,-3.4,1,0.1,1.5,0.7,5.5,-1.4,1.2
42220,"Santa Rosa, CA (Metropolitan Statistical Area)",2.7,-1.6,-0.3,1.8,0.6,-1.7,-0.2,-7.1,-0.6,1.5,-1.8,3.8,3.3,6,1.1,3.1
42340,"Savannah, GA (Metropolitan Statistical Area)",-0.2,1.2,4.9,4.9,2.5,-2.5,-3.2,-5,0.1,-1.4,1.7,0.1,1.6,0.4,-0.4,2.6
42540,"Scranton--Wilkes-Barre--Hazleton, PA (Metropolitan Statistical Area)",0.3,0.6,0.9,-0.8,3.1,-2.6,-1.8,-1,3.1,-0.5,-0.5,4.9,-2.1,3,0.7,0.4
42660,"Seattle-Tacoma-Bellevue, WA (Metropolitan Statistical Area)",0,0.4,0.3,4.8,3,5.9,-0.5,-5.7,0.3,0.4,3.1,1.2,2,2.9,1.8,3.4
42680,"Sebastian-Vero Beach, FL (Metropolitan Statistical Area)",-0.5,3.1,0,1,-0.7,3.7,-4.2,-8.9,-7,-1.7,3.4,-3.1,5.2,3.9,1.1,-4.4
42700,"Sebring, FL (Metropolitan Statistical Area)",7.2,3.7,3.4,3.4,4.7,-6.7,-6.3,0.7,-1,-3.2,1.7,-2.4,-4.9,2.9,-0.2,-0.1
43100,"Sheboygan, WI (Metropolitan Statistical Area)",4.8,0.5,4,-4.8,-0.3,1,-2.6,-2.5,0.2,-1.8,5.5,0.1,1,2.6,6,2.7
43300,"Sherman-Denison, TX (Metropolitan Statistical Area)",0,3.2,7.1,1,5.2,-1.3,0.1,-3.7,2.7,1.9,0.2,4.8,-2.5,1.5,-1.6,0.1
43340,"Shreveport-Bossier City, LA (Metropolitan Statistical Area)",-2.5,-0.7,1.7,3.1,1.4,-2.3,7.6,4,5,-13.8,-5.1,2.5,2.1,5,0.6,1.9
43420,"Sierra Vista-Douglas, AZ (Metropolitan Statistical Area)",1.5,6.4,-1.8,3.3,0,2.1,3.2,5.4,1.2,-2,-5.4,-5.2,-3.2,-0.1,0.1,1.1
43580,"Sioux City, IA-NE-SD (Metropolitan Statistical Area)",1.9,0.6,10.4,2.8,0,0.3,11.5,-3.6,-4.2,-7.4,-5.9,4.6,-0.1,6.4,5.1,-3.8
43620,"Sioux Falls, SD (Metropolitan Statistical Area)",15.9,-0.2,2,0.6,2,2.2,0.9,-0.5,-4,4.4,1.5,-4.9,1.4,1.9,1,-0.4
43780,"South Bend-Mishawaka, IN-MI (Metropolitan Statistical Area)",3.7,3.7,2.5,-0.2,1.7,-0.1,-3.2,-8.2,3.2,4.6,-1.1,-2.6,1.5,2.4,0.5,0.3
43900,"Spartanburg, SC (Metropolitan Statistical Area)",3,3.9,0.1,1,3.2,-0.5,-2.8,-11.7,7.6,1.5,-1.9,1.2,3.1,2,3.5,1.8
44060,"Spokane-Spokane Valley, WA (Metropolitan Statistical Area)",0.1,2.6,1.9,3.2,1.3,1.8,0.7,-2.6,1.3,2.1,-2.3,-0.8,1.2,1,0.2,0.8
44100,"Springfield, IL (Metropolitan Statistical Area)",1.6,-1.1,-1.4,1.4,-1.3,-0.8,-2.4,3.6,2.1,-1.6,-2.4,-3.1,2.3,0.3,0,0.2
44140,"Springfield, MA (Metropolitan Statistical Area)",-0.3,2.2,0.5,2.6,-2.7,0.8,0.1,-2.3,0.9,1,1.4,0.6,-0.3,2.8,0.4,0.6
44180,"Springfield, MO (Metropolitan Statistical Area)",0.8,4.2,2.6,3,4.8,-5.3,-8.2,-3.4,-1.2,-0.1,-1.3,1.4,0.7,2.7,-0.6,2.8
44220,"Springfield, OH (Metropolitan Statistical Area)",-1.9,-2.3,2,0.7,3.7,-4.3,-2.2,-6,1.4,4.3,1.3,2.1,0.6,-1,0.2,3.5
44300,"State College, PA (Metropolitan Statistical Area)",-0.4,0.1,1.1,7.5,-3.8,-1.1,0.6,1.1,2.7,0.9,5,3.8,3.4,2.2,0.2,1.4
44420,"Staunton-Waynesboro, VA (Metropolitan Statistical Area)",-5.6,0.2,3.9,1.8,-2.7,1.4,3.9,4.9,3.3,-7.2,-7.4,1.1,0.5,1.5,-0.6,0.5
44700,"Stockton-Lodi, CA (Metropolitan Statistical Area)",1.5,2.4,1,0.3,-0.6,-3.7,-3,-0.1,-1.7,-3.1,0,1,-0.4,4,1.6,0.6
44940,"Sumter, SC (Metropolitan Statistical Area)",1.4,1.9,1.5,1.5,2.1,-1.7,-4.4,-2.9,0,3.5,5.9,-0.6,0.4,-0.6,0.1,2.9
45060,"Syracuse, NY (Metropolitan Statistical Area)",2.4,0,2.9,2,0.9,1.5,-1.6,-0.7,2.3,-1.4,1.5,-1.9,0.3,1.4,1.4,0.5
45220,"Tallahassee, FL (Metropolitan Statistical Area)",0.2,0.4,1.6,-1.3,-1.1,2.4,-3.6,-3.8,-2.5,-2.3,0.5,0,-0.8,-0.2,1.8,2.2
45300,"Tampa-St. Petersburg-Clearwater, FL (Metropolitan Statistical Area)",3.1,2.5,3.1,2.9,2,0.1,-3.8,-4.6,-1.9,-1.5,1.7,4,-1.8,1.5,0.7,-0.1
45460,"Terre Haute, IN (Metropolitan Statistical Area)",3.8,3.9,3.4,-2.7,2.2,4.2,1,-5.9,4.1,-3.7,-2.5,1.5,-3,-3.6,0.5,1.6
45500,"Texarkana, TX-AR (Metropolitan Statistical Area)",2.3,2.5,4.6,2,0.3,0.8,0.2,-0.7,1.9,-0.4,-2.6,-7,-0.6,2.2,0.7,0
45540,"The Villages, FL (Metropolitan Statistical Area)",2.6,16.7,-0.8,9.8,2,-2.6,-8.4,0.2,4.1,0,0,-3.9,0,-2,3,1.3
45780,"Toledo, OH (Metropolitan Statistical Area)",2.6,0.4,1.4,0.9,2.1,-0.9,-3.9,-1.3,0.1,2.7,-0.8,2.8,8,-3.7,1.2,-0.4
45820,"Topeka, KS (Metropolitan Statistical Area)",0.3,0,5.4,-5,-3.9,3.2,-0.3,-1.3,1.9,-0.9,0.8,-1.9,0.1,-1.5,2.1,0.1
45940,"Trenton, NJ (Metropolitan Statistical Area)",3.8,0.2,0.3,1.8,2.3,-2.2,1.8,-5.3,3,1.7,12.3,-6.8,-1.5,-0.8,0.9,-3
46060,"Tucson, AZ (Metropolitan Statistical Area)",-2.7,4.3,-2.9,1.4,1,3,-0.3,-7,0,-1.7,2.9,-3.4,-2,-2.3,-0.4,1.9
46140,"Tulsa, OK (Metropolitan Statistical Area)",-1.8,-1.9,12,4.6,6.8,3.1,-2.3,-6.7,-1.5,12,6.8,5.9,9,-3.4,-7.3,-1.4
46220,"Tuscaloosa, AL (Metropolitan Statistical Area)",5.8,2.4,7.2,3.9,-2.2,3.7,0,-2.8,3.5,6.5,-3.1,3.4,-3.7,1.2,-3.6,4.7
46300,"Twin Falls, ID (Metropolitan Statistical Area)",2.2,0.5,3,1.4,4.3,-0.3,-2.1,-6.6,2.2,-1.3,1.1,1,3.4,1,2.1,0.4
46340,"Tyler, TX (Metropolitan Statistical Area)",-0.2,-2.9,4.8,4.4,3,0.1,10.5,-3.6,4.1,8.1,1.9,6.8,2.2,7.3,-1.9,-1.4
46520,"Urban Honolulu, HI (Metropolitan Statistical Area)",1.9,4.5,4.8,2.8,3.1,1.4,0.4,-4.1,3.6,-0.6,0.4,1,0.2,3.6,1.7,2.1
46540,"Utica-Rome, NY (Metropolitan Statistical Area)",1.9,1,2.2,2.8,2.5,-0.7,-0.3,0.3,1.5,-2.4,0.9,-0.2,-2,1.2,1.1,0.3
46660,"Valdosta, GA (Metropolitan Statistical Area)",2.1,3.2,0.4,6.5,-2,0.9,-6.1,-1,0.3,-6,0.9,-1.6,0.1,0.5,0.2,1.9
46700,"Vallejo-Fairfield, CA (Metropolitan Statistical Area)",2.8,5.4,-0.1,3.3,-1.3,0.6,4.3,1.6,-4.5,-5,14.7,4,-0.9,-3.5,0.2,1.2
47020,"Victoria, TX (Metropolitan Statistical Area)",1.1,-1.8,3.5,7.7,12.1,-1.4,2.9,-11.3,7.2,-0.3,8.9,6.1,0.6,-4.7,-5.9,1.1
47220,"Vineland-Bridgeton, NJ (Metropolitan Statistical Area)",0.9,3.5,2.8,2.9,-0.1,-3.6,1.6,-0.7,-3.8,-2.8,-1.2,-2.2,1.2,1.5,1.2,0.3
47260,"Virginia Beach-Norfolk-Newport News, VA-NC (Metropolitan Statistical Area)",-1.4,3.1,2.2,4,4.3,1.8,-1.1,-0.5,-2.3,-0.1,-1.4,-1.1,-0.9,2.2,-1.4,0.8
47300,"Visalia-Porterville, CA (Metropolitan Statistical Area)",0.5,1.7,6.1,5.6,-1.4,2.8,-4.9,-7.7,8.7,4.2,-9,4.7,6.9,-1.1,7.7,-7.4
47380,"Waco, TX (Metropolitan Statistical Area)",3.1,5.2,5.2,2,0.9,-0.5,1.1,-0.8,2.2,-1.7,2.9,3,1.5,2.2,0.7,1.8
47460,"Walla Walla, WA (Metropolitan Statistical Area)",0,4.1,-3.4,4,2.8,1.3,3.8,2.6,1.2,-0.9,-1.1,-0.5,-3.4,2.9,6.4,-4.1
47580,"Warner Robins, GA (Metropolitan Statistical Area)",3.1,0.6,-1.7,3.7,-0.2,-1.4,-3.7,-0.6,-0.7,-1.1,-1.8,-2.4,-1,-0.7,0,-0.8
47900,"Washington-Arlington-Alexandria, DC-VA-MD-WV (Metropolitan Statistical Area)",1.2,2.6,4.1,2.5,0.8,0.5,0.5,-1.6,1.6,-0.4,-1.1,-2.3,-0.6,1,0.8,1
47940,"Waterloo-Cedar Falls, IA (Metropolitan Statistical Area)",5.1,-0.1,12.7,2.5,-0.8,3.8,-2.2,-2.4,2,-1.5,15.3,-10,2.9,-0.1,1.2,3.3
48060,"Watertown-Fort Drum, NY (Metropolitan Statistical Area)",-1.2,0.2,4.1,6,8.6,-2.6,3.6,4.7,4.3,1.2,-5.4,-0.7,-2.7,-2,-2.5,-2.4
48140,"Wausau, WI (Metropolitan Statistical Area)",2.8,5.8,2.6,2.4,-1,0.5,-2.3,-5.6,2.4,0.5,5.7,0.2,3.2,4.5,2.4,1.6
48260,"Weirton-Steubenville, WV-OH (Metropolitan Statistical Area)",6.1,-2.3,-2.4,1.3,-6.5,2.4,6.1,-5.8,-4,-0.6,3.5,0.9,5.8,-3.4,4.1,-0.1
48300,"Wenatchee, WA (Metropolitan Statistical Area)",11.6,-6.7,3.2,-1.6,2,-1.2,1.2,3,-2.1,-0.7,0.2,-1.8,1.6,4.6,5.9,3.5
48540,"Wheeling, WV-OH (Metropolitan Statistical Area)",1.9,3.1,0.7,2.4,0.6,1.5,3.9,-0.5,1.8,0.9,5.5,0.5,5.7,-1.6,-0.8,12.2
48620,"Wichita, KS (Metropolitan Statistical Area)",-1.4,-2.1,8,-3.8,4.9,4.5,-3.8,-11.4,7.7,-0.6,1.8,-6.7,2.9,5.2,3.5,-1.5
48660,"Wichita Falls, TX (Metropolitan Statistical Area)",3,-2.5,-2.6,2.2,7.3,3.7,12.2,-4.9,-3.4,7.3,1.2,5.2,-7.5,3.1,-3.5,4.5
48700,"Williamsport, PA (Metropolitan Statistical Area)",-1.2,2.7,0.9,3.6,1,-3.7,-1.9,-0.4,5.8,10,3.1,3.2,4.4,-5.6,-4.2,3.4
48900,"Wilmington, NC (Metropolitan Statistical Area)",0,-0.8,1.4,6.1,1.4,-1.2,-1.3,-3.3,-1.4,0.8,-5.6,5.2,3.2,0.9,-2.1,0.7
49020,"Winchester, VA-WV (Metropolitan Statistical Area)",1.3,1.1,3.6,4,-1.5,-5.7,-6.7,2.2,1.9,0.9,0.6,0.4,0,3.2,0.6,1
49180,"Winston-Salem, NC (Metropolitan Statistical Area)",-4.2,3,3.2,-3,-0.9,-6.4,-2.2,-4.7,2.5,-3.3,-4,0.4,5.1,1.7,-3.1,1.4
49340,"Worcester, MA-CT (Metropolitan Statistical Area)",1.1,3.9,-1.4,-0.3,0.2,-0.7,-0.5,-4.6,3.6,2.6,0.1,0.1,-0.4,2.7,2.5,1.8
49420,"Yakima, WA (Metropolitan Statistical Area)",4.3,2.7,-0.2,2.7,0.8,-0.3,2.4,1.1,2,0.3,-1.6,-2.4,2.6,1.1,4.1,0.2
49620,"York-Hanover, PA (Metropolitan Statistical Area)",0.1,3.2,3.9,5.6,-4.9,1.2,2.6,-6.2,0.4,-3.1,-3.5,2,-1.2,0.9,1.4,2.2
49660,"Youngstown-Warren-Boardman, OH-PA (Metropolitan Statistical Area)",2.8,1.9,1.1,-1.9,2.2,-3.6,-4,-11,5.1,6.8,-0.5,-2.3,1.5,1.9,-0.7,-1.5
49700,"Yuba City, CA (Metropolitan Statistical Area)",5.5,0.7,-1.5,-3.2,-1,-2.9,3.6,5.6,-4.6,-1.3,-2.6,3.6,1,1.6,2.2,0.9
49740,"Yuma, AZ (Metropolitan Statistical Area)",7.3,0.6,6.5,-0.4,1,-2.8,-5.1,-3.2,1.9,-1.3,-6.2,4.2,-3.1,7.9,8.4,-0.7
Legend / Footnotes:,,,,,,,,,,,,,,,,,
1/ Per capita real GDP statistics for 2010-2017 reflect Census Bureau midyear population estimates available as of March 2018.,,,,,,,,,,,,,,,,,
"  Metropolitan Statistical Areas (MSAs) are defined (geographically delineated) by the Office of Management and Budget bulletin no. 17-01 issued August 15, 2017.",,,,,,,,,,,,,,,,,
"  Last updated: September 18, 2018 -- new statistics for 2017; revised statistics for 2001-2016.",,,,,,,,,,,,,,,,,